{
  "$schema": "./vector.schema.json",
  "fixture": "connected-platform",
  "version": 1,
  "comment": "ADR 0006 §5.6 worked vectors — the machine-readable copy of the contract both Cadence (CAD-506) and AgenticOS (AOS-49/52) test against. See README.md for the step/expect semantics. Specimen `record` values embed sha256 hashes of the declared source contents (e.g. deploy-plan v1 hashes to sha256:ee7dbcc5…).",
  "vectors": [
    {
      "id": "declared-read-executes",
      "summary": "A tool declared `read` executes through the proxy at call time; no pending effect is staged (§5.2).",
      "contract": [
        "C1",
        "C2",
        "§5.2"
      ],
      "given": {
        "tool_table": "default",
        "reported_manifest_version": "1",
        "agent": "swe-505",
        "account": "acct-1"
      },
      "steps": [
        {
          "action": "call",
          "tool": "widgets.list",
          "arguments": {
            "limit": 5
          },
          "expect": {
            "result": "executed",
            "fired": true,
            "state": null
          }
        }
      ]
    },
    {
      "id": "declared-draft-executes",
      "summary": "A `draft` tool executes at once like a read — it produces only a revocable artifact and surfaces as an information-only row, never a pending effect (§5.2, §7 Q3).",
      "contract": [
        "C1",
        "§5.2"
      ],
      "given": {
        "tool_table": "default",
        "reported_manifest_version": "1",
        "agent": "swe-505",
        "account": "acct-1"
      },
      "steps": [
        {
          "action": "call",
          "tool": "widgets.preview",
          "arguments": {
            "widget": "w1"
          },
          "expect": {
            "result": "executed",
            "fired": true,
            "state": null
          }
        }
      ]
    },
    {
      "id": "undeclared-tool-parks-as-send",
      "summary": "A tool missing from the table gates as send (C3): the call stages a pending effect instead of executing, so a forgotten declaration surfaces as friction, not a bypass.",
      "contract": [
        "C3",
        "§5.2"
      ],
      "given": {
        "tool_table": "default",
        "reported_manifest_version": "1",
        "agent": "swe-505",
        "account": "acct-1"
      },
      "steps": [
        {
          "action": "call",
          "tool": "widgets.exfiltrate",
          "arguments": {
            "all": true
          },
          "expect": {
            "result": "staged",
            "effect_id": true,
            "fired": false,
            "state": "waiting",
            "record": {
              "request": "req-undeclared-1",
              "kind": "effect",
              "agent": "swe-505",
              "platform": "fixture",
              "account": "acct-1",
              "tool": "widgets.exfiltrate",
              "effect": "send",
              "input_summary": "widgets.exfiltrate {\"all\":true}",
              "input": {
                "all": true
              },
              "preview": "widgets.exfiltrate on fixture/acct-1: {\"all\":true}",
              "effect_id": "eff-undeclared-1",
              "state": "waiting"
            }
          }
        }
      ]
    },
    {
      "id": "unknown-effect-parks-as-send",
      "summary": "A table entry declaring an effect outside read|draft|send is malformed (C1); calls against it gate as send (C3). The table itself is schema-invalid — table_valid:false asserts the fixture schema rejects it.",
      "contract": [
        "C1",
        "C3",
        "§5.2"
      ],
      "given": {
        "tool_table": {
          "manifest_version": "1",
          "platform": "fixture",
          "tools": [
            {
              "tool": "widgets.teleport",
              "effect": "teleport",
              "scopes": [
                "widgets:write"
              ]
            }
          ]
        },
        "table_valid": false,
        "reported_manifest_version": "1",
        "agent": "swe-505",
        "account": "acct-1"
      },
      "steps": [
        {
          "action": "call",
          "tool": "widgets.teleport",
          "arguments": {
            "widget": "w1",
            "to": "prod"
          },
          "expect": {
            "result": "staged",
            "effect_id": true,
            "fired": false,
            "state": "waiting"
          }
        }
      ]
    },
    {
      "id": "missing-effect-parks-as-send",
      "summary": "A table entry with no `effect` field is a malformed declaration; calls against it gate as send (C3's absent-field case).",
      "contract": [
        "C3",
        "§5.2"
      ],
      "given": {
        "tool_table": {
          "manifest_version": "1",
          "platform": "fixture",
          "tools": [
            {
              "tool": "widgets.odd",
              "scopes": [
                "widgets:read"
              ]
            }
          ]
        },
        "table_valid": false,
        "reported_manifest_version": "1",
        "agent": "swe-505",
        "account": "acct-1"
      },
      "steps": [
        {
          "action": "call",
          "tool": "widgets.odd",
          "arguments": {},
          "expect": {
            "result": "staged",
            "effect_id": true,
            "fired": false,
            "state": "waiting"
          }
        }
      ]
    },
    {
      "id": "manifest-version-mismatch-parks",
      "summary": "The table is pinned to manifest version \"1\"; the platform reports \"2\". Every call under a mismatched manifest gates as send — even a declared read (§5.2, C3 per version).",
      "contract": [
        "C3",
        "§5.2"
      ],
      "given": {
        "tool_table": "default",
        "reported_manifest_version": "2",
        "agent": "swe-505",
        "account": "acct-1"
      },
      "steps": [
        {
          "action": "call",
          "tool": "widgets.list",
          "arguments": {
            "limit": 5
          },
          "expect": {
            "result": "staged",
            "effect_id": true,
            "fired": false,
            "state": "waiting"
          }
        }
      ]
    },
    {
      "id": "manifest-version-undeclared-parks",
      "summary": "The platform reports no manifest version at all (null). An undeclared version is undeclared all the way down: calls gate as send (§5.2).",
      "contract": [
        "C3",
        "§5.2"
      ],
      "given": {
        "tool_table": "default",
        "reported_manifest_version": null,
        "agent": "swe-505",
        "account": "acct-1"
      },
      "steps": [
        {
          "action": "call",
          "tool": "widgets.list",
          "arguments": {},
          "expect": {
            "result": "staged",
            "effect_id": true,
            "fired": false,
            "state": "waiting"
          }
        }
      ]
    },
    {
      "id": "effect-argument-ignored",
      "summary": "An `effect` key in call arguments is not a declaration (C2): a send tool stays send when the caller claims `read`, and a read tool stays read when the caller claims `send`.",
      "contract": [
        "C2",
        "§5.2"
      ],
      "given": {
        "tool_table": "default",
        "reported_manifest_version": "1",
        "agent": "swe-505",
        "account": "acct-1"
      },
      "steps": [
        {
          "action": "call",
          "tool": "widgets.publish",
          "arguments": {
            "widget": "w1",
            "effect": "read"
          },
          "expect": {
            "result": "staged",
            "effect_id": true,
            "fired": false,
            "state": "waiting"
          }
        },
        {
          "action": "call",
          "tool": "widgets.list",
          "arguments": {
            "limit": 5,
            "effect": "send"
          },
          "expect": {
            "result": "executed",
            "fired": true
          }
        }
      ]
    },
    {
      "id": "send-stages-executes-on-accept",
      "summary": "The send lifecycle spine (C5, C6, §5.4): the call returns staged + effect_id at once; a retried call with the same handle dedupes (existing); the operator's accept executes the exact staged input once, verified true, outcome delivered as a message; a second press cannot re-fire.",
      "contract": [
        "C5",
        "C6",
        "C9",
        "C10",
        "§5.4"
      ],
      "given": {
        "tool_table": "default",
        "reported_manifest_version": "1",
        "agent": "swe-505",
        "account": "acct-1",
        "sources": {
          "deploy-plan": "widget=w1; target=production; rev=2026-09-25"
        }
      },
      "steps": [
        {
          "action": "call",
          "tool": "widgets.publish",
          "handle": "deploy-w1",
          "arguments": {
            "widget": "w1",
            "source": "deploy-plan"
          },
          "expect": {
            "result": "staged",
            "effect_id": true,
            "fired": false,
            "executions": 0,
            "state": "waiting",
            "record": {
              "request": "req-deploy-w1",
              "kind": "effect",
              "agent": "swe-505",
              "platform": "fixture",
              "account": "acct-1",
              "tool": "widgets.publish",
              "effect": "send",
              "input_summary": "widgets.publish widget=w1 (deploy-plan)",
              "input": {
                "widget": "w1",
                "source": "deploy-plan"
              },
              "preview": "publish w1 to fixture/acct-1 from deploy-plan@sha256:ee7dbcc52faa7b9d053af4ae05dd7f061f0798acd11a9585c0e7ca02c4b945c6",
              "source_hash": "sha256:ee7dbcc52faa7b9d053af4ae05dd7f061f0798acd11a9585c0e7ca02c4b945c6",
              "label": "deploy",
              "effect_id": "eff-deploy-w1",
              "state": "waiting"
            }
          }
        },